enc_input,dec_input
पूर्व मेँ चम्बल नदी के सामान्तर बहती हुई भिण्ड जिला की लहार तहसील के निकट सिन्ध नदी से मिल जाती हैँ,पूर्व मेँ चम्बल नदी के सामान्तर बहती हुई भिण्ड जिले की लहार तहसील के निकट सिन्ध नदी से मिल जाती हैँ
इसे भू स्थिर कक्षा में उपग्रहों और भारतीय अंतरिक्ष यात्री को प्रक्षेपित करने के लिये विकसित किया गया है.,इसे भू स्थिर कक्षा में उपग्रहों और भारतीय अंतरिक्ष यात्रियों को प्रक्षेपित करने के लिये विकसित किया गया है.
इस जनजाति के सदस्यों अंजव और लोहित जिलों में स्थित हैं.,इस जनजाति के सदस्य अंजव और लोहित जिलों में स्थित हैं.
28 अक्टूबर 1976 को इस जिले का विभाजन पूर्व खासी हिल्स जिला और पश्चिम खासी हिल्स जिला के रूप में कर दिया गया.,28 अक्टूबर 1976 को इस जिले का विभाजन पूर्वी खासी हिल्स जिला और पश्चिमी खासी हिल्स जिले के रूप में कर दिया गया.
यह हावड़ा जिला में हुगली नदी के पश्चिमी किनारे पर स्थित है.,यह हावड़ा जिले में हुगली नदी के पश्चिमी किनारे पर स्थित है.
और यह नियम हर एक वस्तुओं पर लागु होता है.,और यह नियम हर एक वस्तु पर लागु होता है.
आईएसआईएस ने इस आत्मघाती हमला की जिम्मेदारी ली.,आईएसआईएस ने इस आत्मघाती हमले की जिम्मेदारी ली.
दुनिया के विविध भाग से तीन सौ से ज्यादा लेखक केरला साहित्योत्सव 2017 के भाग थे.,दुनिया के विविध भागों से तीन सौ से ज्यादा लेखक केरला साहित्योत्सव 2017 के भाग थे.
छपरा से ११ किलोमीटर दक्षिण पूर्व में डोरीगंज बाजार के निकट स्थित चिरांद सारण जिले का सबसे महत्वपूर्ण पुरातत्व स्थल है.,छपरा से ११ किलोमीटर दक्षिण पूर्व में डोरीगंज बाजार के निकट स्थित चिरांद सारण जिला का सबसे महत्वपूर्ण पुरातत्व स्थल है.
"२००७ में, जवाहरलाल नेहरू विश्वविद्यालय के वार्षिक कैलेंडर में उनकी पक्षी की तस्वीरों को चित्रित किया गया था.","२००७ में, जवाहरलाल नेहरू विश्वविद्यालय के वार्षिक कैलेंडर में उनकी पक्षियों की तस्वीरों को चित्रित किया गया था."
उड़ीसा के लोगों उन्हें माँ कहते थे.,उड़ीसा के लोग उन्हें माँ कहते थे.
ये बस गुजरात के बनासकांठा जिला की थी.,वो बस गुजरात के बनासकांठा जिले की थी.
मेरा जन्म तो मंगलुरु मे हुईं,मेरा जन्म तो मंगलुरु मे हुईं
"हॉ यह भी बतादें, दुधारु पशु के गर्भाधान न हो सकने पर नङारधण देवता से मनौती मॉगी जाती है.","हॉ यह भी बतादें, दुधारु पशुओं के गर्भाधान न हो सकने पर नङारधण देवता से मनौती मॉगी जाती है."
रखाइन राज्य पर बर्मी क़ब्ज़े के बाद अत्याचार के माहौल से तंग आ कर बड़ी संख्या में रोहिंग्या लोगों थाईलैंड में शरणार्थी हो गए.,रखाइन राज्य पर बर्मी क़ब्ज़े के बाद अत्याचार के माहौल से तंग आ कर बड़ी संख्या में रोहिंग्या लोग थाईलैंड में शरणार्थी हो गए.
"रोहिंग्या लोगों आम तौर पर मुसलमान होते हैं, लेकिन अल्पसंख्या में कुछ रोहिंग्या हिन्दू भी होते हैं.","रोहिंग्या लोग आम तौर पर मुसलमान होते हैं, लेकिन अल्पसंख्या में कुछ रोहिंग्या हिन्दू भी होते हैं."
युनाइटेड नेशंज़ के मुताबिक़ रोहिंग्या लोगों दुनिया के सब से उत्पीड़ित अल्पसंख्यक समूहों में से एक है.,युनाइटेड नेशंज़ के मुताबिक़ रोहिंग्या लोग दुनिया के सब से उत्पीड़ित अल्पसंख्यक समूहों में से एक है.
बीड जिला के पटोदा तालुक में बालागत पठार के उत्तर पश्चिम के शीर्ष पर चिंचोल पहाड़ी में सिंधफन वृद्धि होती है.,बीड जिले के पटोदा तालुक में बालागत पठार के उत्तर पश्चिम के शीर्ष पर चिंचोल पहाड़ी में सिंधफन वृद्धि होती है.
"युद्ध के सिद्धांत विकसित अवधारण, कानून, नियमों और विधियाँ है.","युद्ध के सिद्धांत विकसित अवधारण, कानून, नियम और विधियाँ है."
विधानसभा भाषाओं और निम्न स्तरीय भाषाओं जैसे बीसीपीएल में आम तौर पर सरणियों के लिए कोई वाक्यविन्यास समर्थन नहीं होता है.,विधानसभा भाषाओं और निम्न स्तरीय भाषा जैसे बीसीपीएल में आम तौर पर सरणियों के लिए कोई वाक्यविन्यास समर्थन नहीं होता है.
हमले तब हुआ जब हुआ चर्च में 400 से अधिक ईसाई लोग रविवार प्रार्थना कर रहे हैं थे.,हमला तब हुआ जब हुआ चर्च में 400 से अधिक ईसाई लोग रविवार प्रार्थना कर रहे हैं थे.
बिसौरी उत्तरी भारत में जौनपुर जिले का एक गांव है जिसकी आबादी लगभग 1000 है.,बिसौरी उत्तरी भारत में जौनपुर जिला का एक गांव है जिसकी आबादी लगभग 1000 है.
"सपना ने नानू की जानू, भांगओवर और वीरे की वेडिंग जैसी कुछ बॉलीवुड फिल्मों में आइटम सॉंग भी किया है.","सपना ने नानू की जानू, भांगओवर और वीरे की वेडिंग जैसी कुछ बॉलीवुड फिल्म में आइटम सॉंग भी किया है."
गौ अभयारण्य अनुसन्धान एवं उत्पादन केन्द्र मध्य प्रदेश के आगर मालवा जिले के सालरिया ग्राम में स्थित है.,गौ अभयारण्य अनुसन्धान एवं उत्पादन केन्द्र मध्य प्रदेश के आगर मालवा जिला के सालरिया ग्राम में स्थित है.
गौ अभयारण्य अनुसन्धान एवं उत्पादन केन्द्र मध्य प्रदेश के आगर मालवा जिला के सालरिया ग्राम में स्थित है.,गौ अभयारण्य अनुसन्धान एवं उत्पादन केन्द्र मध्य प्रदेश के आगर मालवा जिले के सालरिया ग्राम में स्थित है.
ख़त में मुग़ल सेनाध्यक्ष सैयद हसन अली ख़ान बरहा द्वारा राजपूत और मराठा विद्रोहों को ख़त्म करने की कोशिशें का वर्णन था.,ख़त में मुग़ल सेनाध्यक्ष सैयद हसन अली ख़ान बरहा द्वारा राजपूत और मराठा विद्रोहों को ख़त्म करने की कोशिशों का वर्णन था.
२०११ में श्रिलंका में आयोजित दक्षिण एशियाई बीच खेलों में प्रशांति सिहं ने स्वर्ण पदक जीता.,२०११ में श्रिलंका में आयोजित दक्षिण एशियाई बीच खेल में प्रशांति सिहं ने स्वर्ण पदक जीता.
१९९५ के दक्षिण एशियाई खेलों मैं उनके प्रशिक्षित खिलाड़ियों ने १० स्वर्ण पदक और २ रजत पदक जीते थे.,१९९५ के दक्षिण एशियाई खेल मैं उनके प्रशिक्षित खिलाड़ियों ने १० स्वर्ण पदक और २ रजत पदक जीते थे.
"स्वर्ण जैकल, जंगली सुअर, श्रीलंकाई हाथी और यूरोपीय ओटर जैसे स्तनधारियों भी खाने के लिए दलदल पर जाते हैं.","स्वर्ण जैकल, जंगली सुअर, श्रीलंकाई हाथी और यूरोपीय ओटर जैसे स्तनधारी भी खाने के लिए दलदल पर जाते हैं."
वे व्यक्ति जो विभिन्न प्रोग्रामिंग भाषाओं का प्रयोग करके विभिन्न प्रकार के कम्प्यूटर प्रोग्रामों का निर्माण कर सकते हैं.,वे व्यक्ति जो विभिन्न प्रोग्रामिंग भाषा का प्रयोग करके विभिन्न प्रकार के कम्प्यूटर प्रोग्रामों का निर्माण कर सकते हैं.
वे व्यक्ति जो विभिन्न प्रोग्रामिंग भाषा का प्रयोग करके विभिन्न प्रकार के कम्प्यूटर प्रोग्रामों का निर्माण कर सकते हैं.,वे व्यक्ति जो विभिन्न प्रोग्रामिंग भाषाओं का प्रयोग करके विभिन्न प्रकार के कम्प्यूटर प्रोग्रामों का निर्माण कर सकते हैं.
मैं एक सपने देखने वाली हूं और अपने सपने हासिल करने के लिए कड़ी मेहनत करने की कोशिश करती हूं,मैं एक सपना देखने वाली हूं और अपने सपने हासिल करने के लिए कड़ी मेहनत करने की कोशिश करती हूं
रानी  महिलाओं का नाम  अनेक लोगों का नाम है.,रानी  महिला का नाम  अनेक लोगों का नाम है.
हिमालय के इस हिस्से में बहुत कम दौरा किए गए हैं इसलिय इन शिखरों की जानकारी कम है.,हिमालय के इस हिस्से में बहुत कम दौरे किए गए हैं इसलिय इन शिखरों की जानकारी कम है.
इसे कैस्केडिंग स्टाइल शीट्स  सीएसएस  और जावास्क्रिप्ट जैसे स्क्रिप्टिंग भाषाओं जैसी तकनीकों द्वारा सहायता प्रदान की जा सकती है.,इसे कैस्केडिंग स्टाइल शीट्स  सीएसएस  और जावास्क्रिप्ट जैसे स्क्रिप्टिंग भाषा जैसी तकनीकों द्वारा सहायता प्रदान की जा सकती है.
पिपरा दीक्षित उत्तर प्रदेश के देवरिया जिला में स्थित एक गाँव है.,पिपरा दीक्षित उत्तर प्रदेश के देवरिया जिले में स्थित एक गाँव है.
पिपरा दीक्षित उत्तर प्रदेश के देवरिया जिले में स्थित एक गाँव है.,पिपरा दीक्षित उत्तर प्रदेश के देवरिया जिला में स्थित एक गाँव है.
"पिपरा दीक्षित उत्तर प्रदेश के देवरिया जिला में स्थित एक गाँव है, जिसका डाकघर भी इसी गाँव में स्थित है.","पिपरा दीक्षित उत्तर प्रदेश के देवरिया जिले में स्थित एक गाँव है, जिसका डाकघर भी इसी गाँव में स्थित है."
"जबकि दूल्हा और दुल्हन बच गए, दोनों ने परिवार के कई सदस्यों धमाकों के पीड़ित हो गए.","जबकि दूल्हा और दुल्हन बच गए, दोनों ने परिवार के कई सदस्य धमाकों के पीड़ित हो गए."
"2008, 2009, 2015 और 2016 में वैश्विक मंदी के परिणामस्वरूप इस्पात उत्पादक देशों के अधिकांश हिस्से में उत्पादन घट गया.","2008, 2009, 2015 और 2016 में वैश्विक मंदी के परिणामस्वरूप इस्पात उत्पादक देशों के अधिकांश हिस्सों में उत्पादन घट गया."
नदवासराय  नदवाखास  भारत के उत्तर प्रदेश के मऊ जिले के घोसी से 10 किमी दूर स्थित एक छोटा सा गाँव है.,नदवासराय  नदवाखास  भारत के उत्तर प्रदेश के मऊ जिला के घोसी से 10 किमी दूर स्थित एक छोटा सा गाँव है.
"मोरा धनसिरी भारत के असम राज्य में गोलाघाट जिले की मुख्य नदी, धनसिरी नदी की एक सहायक नदी है.","मोरा धनसिरी भारत के असम राज्य में गोलाघाट जिला की मुख्य नदी, धनसिरी नदी की एक सहायक नदी है."
यह देवास जिला के अन्तर्गत आता है.,यह देवास जिले के अन्तर्गत आता है.
इसे बंकिम चन्द्र चट्टोपाध्याय ने बंगाली व संस्कृत भाषाओं मे लिखा था.,इसे बंकिम चन्द्र चट्टोपाध्याय ने बंगाली व संस्कृत भाषा मे लिखा था.
"नेपाल १४ अञ्चल, ७५ जिलों और ५ विकास क्षेत्र में विभाजित है.","नेपाल १४ अञ्चल, ७५ जिलों और ५ विकास क्षेत्रों में विभाजित है."
विगत कुछ दिन से मैं लेखों का संपादन भी कर रहा हूं,विगत कुछ दिनों से मैं लेखों का संपादन भी कर रहा हूं
"मैं वैंडलिज़म, ख़ाली पन्ने वग़ैरह से ऊब जाता हूँ","मैं वैंडलिज़म, ख़ाली पन्नों वग़ैरह से ऊब जाता हूँ"
अगत्ती द्वीप पर एक हवाई अड्डे मौजूद है.,अगत्ती द्वीप पर एक हवाई अड्डा मौजूद है.
कर्नाटक का सबसे ऊंचा स्थल चिकमंगलूर जिला का मुल्लयनगिरि पर्वत है.,कर्नाटक का सबसे ऊंचा स्थल चिकमंगलूर जिले का मुल्लयनगिरि पर्वत है.
"भारत के राज्यों की अपनी चुनी हुई सरकारें होती हैं, लेकिन केंद्र शासित प्रदेशों में सीधे भारत सरकार का शासन होता है.","भारत के राज्य की अपनी चुनी हुई सरकारें होती हैं, लेकिन केंद्र शासित प्रदेशों में सीधे भारत सरकार का शासन होता है."
"भारत के राज्य की अपनी चुनी हुई सरकारें होती हैं, लेकिन केंद्र शासित प्रदेशों में सीधे भारत सरकार का शासन होता है.","भारत के राज्यों की अपनी चुनी हुई सरकारें होती हैं, लेकिन केंद्र शासित प्रदेशों में सीधे भारत सरकार का शासन होता है."
वैशाली जिले का मुख्यालय हाजीपुर में है.,वैशाली जिला का मुख्यालय हाजीपुर में है.
हाजीपुर बिहार प्रान्त के वैशाली जिले का मुख्यालय है.,हाजीपुर बिहार प्रान्त के वैशाली जिला का मुख्यालय है.
चीन की सीमा से लगे होने के कारण अधिकतर क्षेत्र में भारतीय सेना का बाहुल्य दिखाई देता है.,चीन की सीमा से लगे होने के कारण अधिकतर क्षेत्रों में भारतीय सेना का बाहुल्य दिखाई देता है.
मथुरा शहर भारत के उत्तरप्रदेश प्रान्त के मथुरा जिला का एक शहर है.,मथुरा शहर भारत के उत्तरप्रदेश प्रान्त के मथुरा जिले का एक शहर है.
२९ जुलाई २०१६ तक विश्व व्यापार संगठन में १६४ सदस्यों हैं.,२९ जुलाई २०१६ तक विश्व व्यापार संगठन में १६४ सदस्य हैं.
कई मंत्र भाग में भी उपनिषद मिलता है जैसा कि शुक्लयजुर्वेद मन्त्रभाग में इशावास्योपनिषद.,कई मंत्र भागों में भी उपनिषद मिलता है जैसा कि शुक्लयजुर्वेद मन्त्रभाग में इशावास्योपनिषद.
यह भोजपुर जिला का मुख्यालय है.,यह भोजपुर जिले का मुख्यालय है.
सूरदास जन्म से अंधे थे या नहीं इस संबंध में भी विद्वान में मतभेद है उन्होंने हिंदी भाषा को ऊँचा रखने की कोशिश की.,सूरदास जन्म से अंधे थे या नहीं इस संबंध में भी विद्वानों में मतभेद है उन्होंने हिंदी भाषा को ऊँचा रखने की कोशिश की.
जनकपुर संप्रति नेपाल के जनकपुर अञ्चल और धनुषा जिले मे स्थित है.,जनकपुर संप्रति नेपाल के जनकपुर अञ्चल और धनुषा जिला मे स्थित है.
"महर्षि वाल्मीकि को "" श्रीराम "" के जीवन में घटित प्रत्येक घटनाओं का पूर्णरूपेण ज्ञान था.","महर्षि वाल्मीकि को "" श्रीराम "" के जीवन में घटित प्रत्येक घटना का पूर्णरूपेण ज्ञान था."
